{"domain":"aml","effectiveFrom":"2026-01-01T00:00:00Z","effectiveUntil":"2027-01-01T00:00:00Z","entries":[{"code":"REVIEW","label":"Review","meaning":"Analyst review required","rank":10},{"code":"URGENT","label":"Urgent","meaning":"Expedited analyst review","rank":20}],"id":"aml.case-severity","provenance":"synthetic-fixture-v1","purpose":"case-triage","revision":1,"schemaVersion":1}
